{
  "schemaVersion": 2,
  "sessionId": "0123456789abcdef0123456789abcdef",
  "nextCursor": 42,
  "resyncRequired": false,
  "events": [
    {
      "eventId": "11112222333344445555666677778888",
      "cursor": 41,
      "type": "CAST_START",
      "castId": "00112233445566778899aabbccddeeff",
      "actorId": "CHR_MINH_KIEM_01",
      "mapInstanceId": "MAP_BEN_MUA#1",
      "floorId": "OVERWORLD",
      "sourceRevision": 7,
      "serverTick": 1195,
      "emittedAtUtc": "2026-10-30T01:59:59Z"
    },
    {
      "eventId": "a1b2c3d4e5f60718293a4b5c6d7e8f90",
      "cursor": 42,
      "type": "IMPACT",
      "castId": "00112233445566778899aabbccddeeff",
      "actorId": "CHR_MINH_KIEM_01",
      "targetId": "ENT_MAN_BM_SPAWN_BM_01",
      "targetLifeId": 1,
      "hitIndex": 0,
      "mapInstanceId": "MAP_BEN_MUA#1",
      "floorId": "OVERWORLD",
      "sourceRevision": 7,
      "targetRevision": 2,
      "serverTick": 1200,
      "emittedAtUtc": "2026-10-30T02:00:00Z",
      "result": {
        "hit": true,
        "crit": false,
        "immune": false,
        "amount": 27,
        "absorbed": 0,
        "hpDamage": 27
      }
    }
  ]
}
